{
  "schema_version": "2.0",
  "module": "M07",
  "reviewed_commit": "670fcb8a202d8aea43d03f15f435054fdb2685f5",
  "reviewed_at": "2026-08-04",
  "evidence_boundary": "This ledger records a source-level semantic review of lessons, worked answers, case studies, exercises, worksheets, rubrics, and lab guides. It verifies named mechanisms against bounded primary or official sources, distinguishes normative course contracts, and does not turn synthetic examples into production measurements.",
  "claims": [
    {
      "id": "M07-FC-001",
      "location": {
        "path": "lessons/01-workloads-access-paths-data-models.md",
        "heading": "Mechanism and method"
      },
      "claim": "A data model states identities, relationships, constraints, and evolution. A physical design states record layout, partition/order key, index, compression, and maintenance. Mixing the two too early produces technology-shaped requirements.",
      "classification": "algorithmic",
      "source_ids": [
        "RES-03"
      ],
      "source_sections": [
        "Use only Database Storage I-II, Memory Management, and Indexes & Filters I-II notes/slides; produce a physical-path diagram and workload-dependent question."
      ],
      "verification_method": "primary-source comparison",
      "status": "verified",
      "scope_limit": "This verification is limited to the mechanism and failure assumptions stated in the lesson; examples and lab values are synthetic unless explicitly identified as measured evidence.",
      "verified_at": "2026-08-04",
      "claim_sha256": "d21db5c6357c941b00976c5938d0a11c0baba09515ebced064fb81791aa07541",
      "source_section_sha256": [
        "eafca80144c42b7c41041ab6ac2e0c8c856b86cf9cee19b6f51fb0ace0c05bab"
      ]
    },
    {
      "id": "M07-FC-002",
      "location": {
        "path": "lessons/02-pages-records-buffer-pools.md",
        "heading": "Mechanism and method"
      },
      "claim": "Storage engines manage records in pages because devices, caches, checksums, and replacement policies need bounded units. A page commonly includes a header, slot or pointer array, free space, cells, and possibly overflow references. Variable-length records make occupancy a distribution, not one constant.",
      "classification": "algorithmic",
      "source_ids": [
        "RES-01",
        "RES-03"
      ],
      "source_sections": [
        "SQLite Database File Format Sections 1.2, 1.6, and 2.1 on pages, page headers, cells, free space, overflow, and bounded on-disk units.",
        "CMU Database Systems Storage I-II and Memory Management materials on page-oriented storage, record layout, buffer management, and variable-length records."
      ],
      "verification_method": "primary-source comparison",
      "status": "verified",
      "scope_limit": "This verification is limited to the mechanism and failure assumptions stated in the lesson; examples and lab values are synthetic unless explicitly identified as measured evidence.",
      "verified_at": "2026-08-04",
      "claim_sha256": "6077a3c838cef01266fc225b80870c0b21375cff2fc32ecaf6d6d0c97333baf2",
      "source_section_sha256": [
        "cb99c3e06c5e6a88ffff8bc3fc4bfdb9f23a86348b0a21fbf9ef2f3c832db3cd",
        "877cf0e7c78559d49a0855e359755d82313702c6e4f9dc82ba23778217d21253"
      ]
    },
    {
      "id": "M07-FC-003",
      "location": {
        "path": "lessons/03-btree-hash-inverted-indexes.md",
        "heading": "Mechanism and method"
      },
      "claim": "A B+ tree stores data entries in ordered leaves and separators in interior pages. Every root-to-leaf path has equal depth. Linked leaves turn a range scan into one traversal plus sequential leaf visits.",
      "classification": "algorithmic",
      "source_ids": [
        "RES-02"
      ],
      "source_sections": [
        "Watch through deletion and composite indexes; predict changed pages for one insert/delete and compare with the lab trace."
      ],
      "verification_method": "primary-source comparison",
      "status": "verified",
      "scope_limit": "This verification is limited to the mechanism and failure assumptions stated in the lesson; examples and lab values are synthetic unless explicitly identified as measured evidence.",
      "verified_at": "2026-08-04",
      "claim_sha256": "f5ece247ed9bc9fa9b311807a07a008495aebe7b9b05db5a8254229731d177de",
      "source_section_sha256": [
        "fd2f7eb915fd3769d4f5ab45e3a3daf2180b609879cfdca8d7f4c1d1c1f8c136"
      ]
    },
    {
      "id": "M07-FC-004",
      "location": {
        "path": "lessons/04-lsm-bloom-compaction.md",
        "heading": "Mechanism and method"
      },
      "claim": "An LSM trades in-place page updates for buffered sequential output. The lab stores recent writes in an ordered memtable. At a threshold it writes an immutable sorted table containing framed entries, fence offsets, and a Bloom filter. A manifest orders tables newest-first.",
      "classification": "algorithmic",
      "source_ids": [
        "RES-04"
      ],
      "source_sections": [
        "Read the Abstract and Sections 1-3; derive why buffering changes write cost and list assumptions that differ from the lab."
      ],
      "verification_method": "primary-source comparison",
      "status": "verified",
      "scope_limit": "This verification is limited to the mechanism and failure assumptions stated in the lesson; examples and lab values are synthetic unless explicitly identified as measured evidence.",
      "verified_at": "2026-08-04",
      "claim_sha256": "4c9edfdb465f886bb12db2c22e0fcd5794b29bb0d5784d78289410f02dfc3e88",
      "source_section_sha256": [
        "3fd32e08b0a604103e96dc83d3d91fbf6a712f352abbbe0d4fb2f15abb3c9f15"
      ]
    },
    {
      "id": "M07-FC-005",
      "location": {
        "path": "lessons/05-amplification-ssd-endurance.md",
        "heading": "Mechanism and method"
      },
      "claim": "Read, write, and space amplification compare explicitly bounded physical work with logical application work; ratios with different inclusions are not comparable.",
      "classification": "quantitative",
      "source_ids": [
        "RES-05"
      ],
      "source_sections": [
        "Read Architecture and Compaction Styles; compare leveled, tiered/universal, and FIFO under three amplification dimensions."
      ],
      "verification_method": "reproducible derivation",
      "status": "verified",
      "scope_limit": "This verification is limited to the mechanism and failure assumptions stated in the lesson; examples and lab values are synthetic unless explicitly identified as measured evidence.",
      "verified_at": "2026-08-04",
      "claim_sha256": "a8581a029b9c13af056933788025be15d7a55a166022c5fd6b5ce332e6260955",
      "source_section_sha256": [
        "6e9806b3918f821e5d8a0840cc3161187c4fa70510fbe0e2cbe564b2dfdafc90"
      ]
    },
    {
      "id": "M07-FC-006",
      "location": {
        "path": "lessons/06-query-plans-statistics-indexes.md",
        "heading": "Mechanism and method"
      },
      "claim": "A planner enumerates legal physical plans, estimates their rows and cost, and chooses the least estimated cost. A plan is a tree of scans, joins, sorts, and aggregates. Statistics approximate distribution; estimates can be wrong because data changed, sampling missed skew, or predicates are correlated.",
      "classification": "algorithmic",
      "source_ids": [
        "RES-09",
        "RES-10"
      ],
      "source_sections": [
        "PostgreSQL Using EXPLAIN Sections 14.1.1-14.1.3 on plan trees, cost estimates, and estimated versus actual rows.",
        "PostgreSQL planner statistics Sections 14.2.1-14.2.2 on distribution statistics, extended statistics, and correlated predicates."
      ],
      "verification_method": "primary-source comparison",
      "status": "verified",
      "scope_limit": "This verification is limited to the mechanism and failure assumptions stated in the lesson; examples and lab values are synthetic unless explicitly identified as measured evidence.",
      "verified_at": "2026-08-04",
      "claim_sha256": "3a5e5ecb007d64e718349d1786e09b11c9164d7c4f18c3d5a09962d84cb8a538",
      "source_section_sha256": [
        "b3bf6776c8548d14f94cec2845fd3dcbab158aecc0e5f18296ae6f8d3b3b8d97",
        "999af3af7b60580601f344560dc943e99eaa39a995292cb9a5cf54b93bc3cf3a"
      ]
    },
    {
      "id": "M07-FC-007",
      "location": {
        "path": "lessons/07-skew-debt-stalls-diagnosis.md",
        "heading": "Mechanism and method"
      },
      "claim": "Average load hides concentration. Hot keys repeatedly update the same logical records, alter cache locality, create overlapping versions, and focus compaction. Delete-heavy work writes new tombstones before reclaiming old values. If flush creates runs faster than compaction consumes them, pending bytes and read sources grow. A temporary burst becomes a sustained failure when that state feeds back into slower reads/writes and still less compaction.",
      "classification": "algorithmic",
      "source_ids": [
        "RES-07"
      ],
      "source_sections": [
        "Read the complete page; map every trigger to a metric, owner, and safe overload action."
      ],
      "verification_method": "official-documentation comparison",
      "status": "verified",
      "scope_limit": "This verification is limited to the mechanism and failure assumptions stated in the lesson; examples and lab values are synthetic unless explicitly identified as measured evidence.",
      "verified_at": "2026-08-04",
      "claim_sha256": "5d54c0307bed405d9ecd60baa91a7594d2cce0be53dd212e71ce0fc79fff5229",
      "source_section_sha256": [
        "3df8e9b6fa09c9feef40d4e1f159ac2b92cd85b6b7ea31b17092abb1465c866f"
      ]
    },
    {
      "id": "M07-FC-008",
      "location": {
        "path": "lessons/08-storage-decisions-migration-ownership.md",
        "heading": "Mechanism and method"
      },